"ID","地域","緯度","経度","ジャンル1","サブジャンル1","ジャンル2","サブジャンル2","ジャンル3","サブジャンル3","名称","概略","郵便番号","住所","電話番号","Fax番号","E-mail","開館時間","休館日","料金","備考","リンク"
"2006","金沢市","36.4943","136.749563","文化・芸術","","観光","歴史・文化施設","","","金沢湯涌創作の森","金沢の奥座敷として古くから親しまれてきた湯涌温泉の入口にあります。明治・大正期の貴重な建物を保存活用するため、里山の新たな文化拠点として整備しました。５つの登録有形文化財を含む古民家群は、藍染・草木染、版画制作のための専門設備をもった工房やギャラリーへ改装、誰もが使える自由な創作活動・作品発表の場となっています。","920-1135","金沢市北袋町ヱ36","076-235-1116","076-235-1070","y-sousaku@kanazawa-arts.or.jp","9:00〜21:00　※宿泊できます。(受付時間、入場・見学は9:00～17:00)","火曜日（祝日の場合はその翌日）、年末年始(12月29日から1月3日)","ＨＰをご確認ください。","","http://www.sousaku-mori.gr.jp/"
"2007","金沢市","36.560867","136.658258","文化・芸術","","観光","美術館・博物館","","","金沢21世紀美術館","金沢21世紀美術館は、兼六園に隣接し、中心部に位置しています。「新しい文化の創造」と「新たなまちの賑わいの創出」を目的に開設されました。ガラス張りの円形の建物で、誰もがいつでも立ち寄ることができる｢まちに開かれた公園のような美術館｣を目指しています。無料ゾーンにも作品があり、体感することができます。","920-8509","金沢市広坂1-2-1","076-220-2800","076-220-2802","bijyutsukan@kanazawa-arts.or.jp","展覧会ゾーン10:00〜18:00（金・土は20:00　※チケットの販売は閉場の30分前まで）無料ゾーン9:00～22:00","月曜日（祝日の場合は直後の翌平日）、年末年始(12月29日から1月3日)、展示替期間は休館","美術館の建物への入館（交流ゾーン）　無料コレクション展　一般　360円、大学生・65歳以上　280円、高校生以下　無料 ※特別展は展覧会毎に異なります。","","http://www.kanazawa21.jp/"
"2008","金沢市","36.561567","136.658122","文化・芸術","","観光","美術館・博物館","","","金沢能楽美術館","金沢能楽美術館は、加賀宝生に伝わる貴重な能面や能装束を収蔵展示する施設として建設されました。「加賀宝生」は、金沢の無形文化財に指定され、「能楽」は、ユネスコの無形文化遺産に登録されています。貴重な美術品と伝統芸能を次世代へ伝え、伝統を現代、さらに未来へと繋げていく新しい文化施設となることをめざしています。","920-0962","金沢市広坂1-2-25","076-220-2790","076-220-2791","noh-museum@kanazawa-arts.or.jp","10:00〜18:00(入館は17:30まで)","月曜日（祝日の場合は翌平日）、年末年始(12月29日から1月3日)、展示替期間は休館","一般　300円、65歳以上　200円、高校生以下　無料 21世紀美術館共通券（コレクション展のみ） 一般　510円、大学生・65歳以上　460円　※別料金の場合があります。","","http://www.kanazawa-noh-museum.gr.jp/"
"2011","金沢市","36.56509","136.649333","文化・芸術","","観光","歴史・文化施設","観光","庭園・公園","旧加賀藩士高田家跡","藩政時代の長屋門を修復し、一般公開している。敷地内には見事な池泉回遊式庭園を配し、藩政時代の面影を残している。","920-0865","金沢市長町2-6-1","076-263-3640","","","午前９時30分から午後５時","無休","無料","",""
"2012","金沢市","36.5661108","136.6499914","文化・芸術","","観光","歴史・文化施設","","","足軽資料館","藩政時代の貴重な足軽屋敷２棟を移築再現したもの。建物の中は、足軽の職務や日常生活の解説・展示がなされており、屋根は昔ながらの石を置いたもので、当時の雰囲気をかもし出している。","920-0865","金沢市長町1-9-3","076-263-3640","","","午前９時30分から午後５時","無休","無料","",""
"2013","金沢市","36.5566619","136.6473336","文化・芸術","","観光","歴史・文化施設","観光","その他","西茶屋資料館","作家島田清次郎が青年期を過ごした「吉米楼」跡に、茶屋家屋の外観を再現した資料館。清次郎に関する資料が展示されているほか、観光ボランティアガイド「まいどさん」が常駐し、周辺散策の案内も行っている。","921-8031","金沢市野町2-25-18","076-247-8110","","","午前９時30分から午後５時","無休","無料","",""
"2014","金沢市","36.5644527","136.6495665","文化・芸術","","観光","歴史・文化施設","観光","その他","長町武家屋敷休憩館","長町にある休憩館。休憩室やトイレ、展示コーナーがあるほか、観光ボランティアガイド「まいどさん」が常駐し、周辺散策の案内も行っている。","920-0865","金沢市長町2-4-36","076-263-1951","","","午前９時から午後５時(12/1～3/15は午前９時30分開館)","無休","無料","",""
"2015","金沢市","36.5723574","136.6658403","文化・芸術","","観光","歴史・文化施設","観光","その他","ひがし茶屋休憩館","江戸時代末期の町家を復元した、東山にある休憩館。観光ボランティアガイド「まいどさん」が常駐し、周辺散策の案内も行っている。","920-0831","金沢市東山1-5-14","076-253-0087","","","午前９時から午後５時(12/1～3/15は午前９時30分開館)","無休","無料","",""
